{
  "$schema": "../../../schemas/atlas-project.schema.json",
  "version": 1,
  "type": "grid",
  "output": {
    "format": "webp",
    "lossless": true
  },
  "frames": [
    {
      "id": "antimatter",
      "source": "antimatter.png",
      "slot": 0
    },
    {
      "id": "antimatter_block",
      "source": "antimatter_block.png",
      "slot": 1
    },
    {
      "id": "basalt",
      "source": "basalt.png",
      "slot": 2
    },
    {
      "id": "bedrock",
      "source": "bedrock.png",
      "slot": 3
    },
    {
      "id": "clay",
      "source": "clay.png",
      "slot": 4
    },
    {
      "id": "clay_block",
      "source": "clay_block.png",
      "slot": 5
    },
    {
      "id": "copper",
      "source": "copper.png",
      "slot": 6
    },
    {
      "id": "crystal",
      "source": "crystal.png",
      "slot": 7
    },
    {
      "id": "diamond",
      "source": "diamond.png",
      "slot": 8
    },
    {
      "id": "dirt",
      "source": "dirt.png",
      "slot": 9
    },
    {
      "id": "echo",
      "source": "echo.png",
      "slot": 10
    },
    {
      "id": "echo_ore",
      "source": "echo_ore.png",
      "slot": 11
    },
    {
      "id": "emerald",
      "source": "emerald.png",
      "slot": 12
    },
    {
      "id": "explosive",
      "source": "explosive.png",
      "slot": 13
    },
    {
      "id": "gold",
      "source": "gold.png",
      "slot": 14
    },
    {
      "id": "granite",
      "source": "granite.png",
      "slot": 15
    },
    {
      "id": "gravel",
      "source": "gravel.png",
      "slot": 16
    },
    {
      "id": "ice",
      "source": "ice.png",
      "slot": 17
    },
    {
      "id": "iron",
      "source": "iron.png",
      "slot": 18
    },
    {
      "id": "light",
      "source": "light.png",
      "slot": 19
    },
    {
      "id": "living",
      "source": "living.png",
      "slot": 20
    },
    {
      "id": "living_rock",
      "source": "living_rock.png",
      "slot": 21
    },
    {
      "id": "magma",
      "source": "magma.png",
      "slot": 22
    },
    {
      "id": "marble",
      "source": "marble.png",
      "slot": 23
    },
    {
      "id": "marble_block",
      "source": "marble_block.png",
      "slot": 24
    },
    {
      "id": "metal_ore",
      "source": "metal_ore.png",
      "slot": 25
    },
    {
      "id": "meteorite",
      "source": "meteorite.png",
      "slot": 26
    },
    {
      "id": "mirror",
      "source": "mirror.png",
      "slot": 27
    },
    {
      "id": "mirror_shard",
      "source": "mirror_shard.png",
      "slot": 28
    },
    {
      "id": "moonstone",
      "source": "moonstone.png",
      "slot": 29
    },
    {
      "id": "obsidian",
      "source": "obsidian.png",
      "slot": 30
    },
    {
      "id": "platinum",
      "source": "platinum.png",
      "slot": 31
    },
    {
      "id": "prisma",
      "source": "prisma.png",
      "slot": 32
    },
    {
      "id": "prismatic",
      "source": "prismatic.png",
      "slot": 33
    },
    {
      "id": "quantum",
      "source": "quantum.png",
      "slot": 34
    },
    {
      "id": "ruby",
      "source": "ruby.png",
      "slot": 35
    },
    {
      "id": "sand",
      "source": "sand.png",
      "slot": 36
    },
    {
      "id": "sapphire",
      "source": "sapphire.png",
      "slot": 37
    },
    {
      "id": "shadow",
      "source": "shadow.png",
      "slot": 38
    },
    {
      "id": "shadow_ore",
      "source": "shadow_ore.png",
      "slot": 39
    },
    {
      "id": "silver",
      "source": "silver.png",
      "slot": 40
    },
    {
      "id": "slate",
      "source": "slate.png",
      "slot": 41
    },
    {
      "id": "slate_block",
      "source": "slate_block.png",
      "slot": 42
    },
    {
      "id": "soulstone",
      "source": "soulstone.png",
      "slot": 43
    },
    {
      "id": "stardust",
      "source": "stardust.png",
      "slot": 44
    },
    {
      "id": "stardust_ore",
      "source": "stardust_ore.png",
      "slot": 45
    },
    {
      "id": "stone",
      "source": "stone.png",
      "slot": 46
    },
    {
      "id": "sunstone",
      "source": "sunstone.png",
      "slot": 47
    },
    {
      "id": "sunstone_ore",
      "source": "sunstone_ore.png",
      "slot": 48
    },
    {
      "id": "time",
      "source": "time.png",
      "slot": 49
    },
    {
      "id": "void",
      "source": "void.png",
      "slot": 50
    }
  ],
  "tileWidth": 96,
  "tileHeight": 96,
  "columns": 8,
  "rows": 7
}
